{
  "title": "Google Chrome Test",
  "publisher": "Google Inc",
  "package_id": "google-chrome",
  "version": "147.0.7727.102",
  "owners": {
    "team": "euc-packaging",
    "contact_email": "euc-packaging@fiserv.com"
  },
  "lifecycle": "active",
  "platforms": {
    "windows": {
      "enabled": false,
      "framework": "psadt-enterprise",
      "framework_version": "4.1.0"
    },
    "macos": {
      "enabled": true,
      "framework": "macos-packaging-framework",
      "framework_version": "1.0.0"
    }
  },
  "deployment": {
    "windows": "intune",
    "macos": "jamf"
  }
}
